{
  "artifact_hash": "sha256:99fb774a8754350835a8a7b663f5b755780d19ef83a8907fc8e6ec77400c0cff",
  "artifact_id": "6beec632-8baf-5a58-a4ce-fa14784d8435",
  "authoritative_source_hash": "sha256:f7f5fee834fb1cb98d1a63f41aec45ae20117b6876d1e4a8b5eb09ee18184c2b",
  "decided_at": "2026-08-01T08:30:45-05:00",
  "decided_by": {
    "authority_name": "thomasverburgt",
    "authority_role": "requirements-acceptance-authority"
  },
  "decision_authority": "human",
  "disposition": "accept_review_as_complete",
  "effect": "record_only",
  "packet_hash": "sha256:56d6d8cf8f5d651666ecbac424f42c02882c13acb02c427cda8e81fb248d013e",
  "packet_id": "f7ff7c64-51e8-5a7f-8acf-d5d5c5f504e8",
  "rationale": "The ADR-0020 CAP-REQ results are approved as a complete and correctly bounded requirements review. Zero declared requirements remains unassessable, not satisfied; GAP-REQ-001 and DC-REQ-001 remain explicit. This approval grants no capability-readiness, risk-acceptance, scheduling, deployment, or requirement-satisfaction authority.",
  "response_hash": "sha256:3cc3817dad00267c64b714726cfaba102dd6abaf10df67afd9c235f767f53338",
  "response_id": "1c27b946-eed2-54f1-994a-b39f8a12d33b"
}
